{
  "schema_version": 1,
  "generated_at": "2026-05-28T17:31:05.092428+00:00",
  "report_kind": "node_compat_trend_snapshot",
  "baseline_available": true,
  "current_sources": {
    "status": "target/node-compat/status/status-summary.json",
    "dashboard": "target/node-compat/dashboard/dashboard-summary.json"
  },
  "baseline_sources": {
    "status": "docs/architecture/runtime/node-compat-evidence/latest/status-summary.json",
    "dashboard": "docs/architecture/runtime/node-compat-evidence/latest/dashboard-summary.json"
  },
  "lane_trends": [
    {
      "lane": "node20",
      "upstream_tag": "v20.20.2",
      "baseline_upstream_tag": "v20.20.2",
      "vendored_test_file_count": 1308,
      "vendored_test_file_count_delta": 0,
      "documented_manifested_green_count": 901,
      "documented_manifested_green_count_delta": 0,
      "unmanifested_or_unclassified_count": 0,
      "unmanifested_or_unclassified_count_delta": 0,
      "documented_manifested_green_ratio": 0.688838,
      "documented_manifested_green_ratio_delta": 0.0
    },
    {
      "lane": "node22",
      "upstream_tag": "v22.15.0",
      "baseline_upstream_tag": "v22.15.0",
      "vendored_test_file_count": 1283,
      "vendored_test_file_count_delta": 0,
      "documented_manifested_green_count": 873,
      "documented_manifested_green_count_delta": 0,
      "unmanifested_or_unclassified_count": 0,
      "unmanifested_or_unclassified_count_delta": 0,
      "documented_manifested_green_ratio": 0.680436,
      "documented_manifested_green_ratio_delta": 0.0
    },
    {
      "lane": "node24",
      "upstream_tag": "v24.15.0",
      "baseline_upstream_tag": "v24.15.0",
      "vendored_test_file_count": 1495,
      "vendored_test_file_count_delta": 0,
      "documented_manifested_green_count": 922,
      "documented_manifested_green_count_delta": 0,
      "unmanifested_or_unclassified_count": 0,
      "unmanifested_or_unclassified_count_delta": 0,
      "documented_manifested_green_ratio": 0.616722,
      "documented_manifested_green_ratio_delta": 0.0
    }
  ],
  "evidence_trends": {
    "canary_report_count": {
      "current": 2,
      "baseline": 0,
      "delta": 2
    },
    "expectation_catalog_entry_count": {
      "current": 67,
      "baseline": 67,
      "delta": 0
    },
    "oracle_report_count": {
      "current": 1,
      "baseline": 0,
      "delta": 1
    },
    "required_canary_gap_count": {
      "current": 0,
      "baseline": 0,
      "delta": 0
    },
    "rust_ignore_count": {
      "current": 67,
      "baseline": 67,
      "delta": 0
    },
    "slice_report_count": {
      "current": 8,
      "baseline": 0,
      "delta": 8
    },
    "unexpected_pass_count": {
      "current": 0,
      "baseline": 0,
      "delta": 0
    },
    "warning_count": {
      "current": 0,
      "baseline": 0,
      "delta": 0
    }
  }
}
